{
  "vcon": "0.4.0",
  "uuid": "019ff387-5c39-8fd7-9dd8-dd37220d739c",
  "parties": [
    {
      "name": "IETF Attendees",
      "role": "attendee"
    }
  ],
  "dialog": [
    {
      "type": "recording",
      "start": "2019-07-21T14:00:00+00:00",
      "parties": [
        0,
        1,
        2
      ],
      "mediatype": "video/mp4",
      "url": "https://www.youtube.com/watch?v=wO8ffXbDu8A",
      "duration": 7200,
      "meta": {
        "ietf_meeting": 105,
        "working_group": "iepg"
      }
    }
  ],
  "attachments": [
    {
      "purpose": "meeting_metadata",
      "body": "{\"ietf_meeting_number\": 105, \"location\": \"Montreal, CA\", \"working_group\": \"iepg\", \"session_id\": \"27419\", \"room\": \"Viger\", \"start_time\": \"2019-07-21T14:00:00+00:00\", \"duration_seconds\": 7200}",
      "encoding": "json",
      "party": 0,
      "dialog": 0,
      "start": "2026-08-12T01:12:42.298033+00:00"
    },
    {
      "purpose": "ingress_info",
      "body": "{\"source\": \"ietf2vcon\", \"converter_version\": \"0.1.0\", \"converted_at\": \"2026-08-12T01:12:42.298315+00:00\", \"meeting_number\": 105, \"group_acronym\": \"iepg\", \"session_index\": 0}",
      "encoding": "json",
      "party": 0,
      "dialog": 0,
      "start": "2026-08-12T01:12:42.298033+00:00"
    },
    {
      "purpose": "lawful_basis",
      "encoding": "json",
      "body": "{\"lawful_basis\": \"legitimate_interests\", \"expiration\": \"2099-12-31T23:59:59+00:00\", \"purpose_grants\": [{\"purpose\": \"recording\", \"granted\": true, \"granted_at\": \"2026-08-12T01:12:42.298352+00:00\"}, {\"purpose\": \"transcription\", \"granted\": true, \"granted_at\": \"2026-08-12T01:12:42.298356+00:00\"}, {\"purpose\": \"publication\", \"granted\": true, \"granted_at\": \"2026-08-12T01:12:42.298361+00:00\"}, {\"purpose\": \"archival\", \"granted\": true, \"granted_at\": \"2026-08-12T01:12:42.298364+00:00\"}, {\"purpose\": \"analysis\", \"granted\": true, \"granted_at\": \"2026-08-12T01:12:42.298366+00:00\"}], \"terms_of_service\": \"https://www.ietf.org/about/note-well/\", \"metadata\": {\"terms_of_service_name\": \"IETF Note Well\", \"jurisdiction\": \"IETF\", \"controller\": \"Internet Engineering Task Force (IETF)\", \"notes\": \"Participation in IETF meetings constitutes agreement to the Note Well, which permits recording, transcription, and public archival of proceedings. See also BCP 78 (RFC 5378) and BCP 79 (RFC 8179) for IPR policies.\"}}",
      "party": 0,
      "dialog": 0,
      "start": "2026-08-12T01:12:42.298033+00:00"
    },
    {
      "purpose": "agenda",
      "body": "{\"url\": \"https://datatracker.ietf.org/meeting/105/session/iepg/\", \"mimetype\": \"text/html\", \"filename\": null, \"title\": \"IEPG Agenda\"}",
      "encoding": "json",
      "party": 0,
      "dialog": 0,
      "start": "2026-08-12T01:12:42.298033+00:00"
    },
    {
      "purpose": "minutes",
      "body": "{\"url\": \"https://notes.ietf.org/notes-ietf-105-iepg\", \"mimetype\": \"text/markdown\", \"filename\": null, \"title\": \"IEPG Notes\"}",
      "encoding": "json",
      "party": 0,
      "dialog": 0,
      "start": "2026-08-12T01:12:42.298033+00:00"
    }
  ],
  "analysis": [
    {
      "type": "wtf_transcription",
      "dialog": 0,
      "vendor": "youtube",
      "product": "auto-captions",
      "url": "https://github.com/vcon-dev/ietf-meeting-vcons/releases/download/transcripts-ietf105/ietf105_iepg_27419.wtf.json",
      "content_hash": "sha512-CQeWo8cS2A3Sme3Z9Ygk1rC3ZG_VS5qWSlMsng1hXeTyQEi8kAZbdoN_OowwpeyYtLNOkfODJ-SbJti-mZmT3g",
      "mediatype": "application/json"
    }
  ],
  "created_at": "2026-08-12T01:12:42.298033+00:00",
  "subject": "IETF 105 - IEPG Working Group Session",
  "extensions": [
    "lawful_basis",
    "wtf_transcription",
    "role",
    "meta"
  ],
  "updated_at": "2026-08-12T01:54:46.826827+00:00"
}
